{
  "@context": ["https://www.w3.org/ns/credentials/v2", "https://web-of-trust.de/vocab/v1"],
  "type": ["VerifiableCredential", "WotAttestation"],
  "issuer": "did:key:z6Mko3ZEjKJWQAM5nDXKoZ9jErvvxbWbYgS8KJXYpC5Hbu8a",
  "credentialSubject": {
    "id": "did:key:z6MkpTHR8VNsBxYAAWHut2Geadd9jSwuBV8xRoAnwWsdvktH",
    "claim": "kann gut programmieren"
  },
  "validFrom": "2026-04-21T10:00:00Z",
  "iss": "did:key:z6Mko3ZEjKJWQAM5nDXKoZ9jErvvxbWbYgS8KJXYpC5Hbu8a",
  "sub": "did:key:z6MkpTHR8VNsBxYAAWHut2Geadd9jSwuBV8xRoAnwWsdvktH",
  "nbf": 1776765600
}
